{
  "schema_version": 1,
  "argument_analysis_id": "arguments_case_0001_v1",
  "case_id": "case_0001",
  "status": "completed",
  "generated_at": "2026-09-03T11:27:18.052840+03:00",
  "analysis_metadata": {
    "issues_input_hash": "03acaec305fd96d72bc6346d0ee48377197d18229ca508ad014001e057951f1c",
    "facts_input_hash": "b7e1e72d273850783fde1ceb64f2925d42a877913f20f756637a4e8f6c6b9a9a",
    "evidence_input_hash": null,
    "legal_research_input_hash": "fc77eb358c0f03b3b08a8fb51c9b8dceffc97762791c1f70629d1133137d04ec",
    "case_law_input_hash": "44136fa355b3678a1146ad16f7e8649e94fb4fc21fe77e8310c060f61caaff8a",
    "timeline_input_hash": "89e783bf2e971cd1462a8ddd41c1aa73579752e1757e03b2ba781a482e56e195",
    "deadline_input_hash": "d4f80c80f48059a5fea58f954b6e2528f38b6cf191bc57e2dd49cde2f8dadaef"
  },
  "argument_coverage": [
    {
      "coverage_id": "coverage_issue_001",
      "source_issue_id": "issue_001",
      "execution_state": "analysis_not_run",
      "allowlist_count": 3,
      "claim_count": 0,
      "counterargument_count": 0,
      "rebuttal_count": 0,
      "suggestion_count": 0,
      "reason_codes": [],
      "trigger_rule_id": "argument_rule_deterministic_allowlist_v1",
      "requires_human_review": true,
      "status": "candidate"
    },
    {
      "coverage_id": "coverage_issue_002",
      "source_issue_id": "issue_002",
      "execution_state": "analysis_not_run",
      "allowlist_count": 5,
      "claim_count": 0,
      "counterargument_count": 0,
      "rebuttal_count": 0,
      "suggestion_count": 0,
      "reason_codes": [],
      "trigger_rule_id": "argument_rule_deterministic_allowlist_v1",
      "requires_human_review": true,
      "status": "candidate"
    },
    {
      "coverage_id": "coverage_issue_003",
      "source_issue_id": "issue_003",
      "execution_state": "analysis_not_run",
      "allowlist_count": 1,
      "claim_count": 0,
      "counterargument_count": 0,
      "rebuttal_count": 0,
      "suggestion_count": 0,
      "reason_codes": [],
      "trigger_rule_id": "argument_rule_deterministic_allowlist_v1",
      "requires_human_review": true,
      "status": "candidate"
    },
    {
      "coverage_id": "coverage_issue_004",
      "source_issue_id": "issue_004",
      "execution_state": "analysis_not_run",
      "allowlist_count": 1,
      "claim_count": 0,
      "counterargument_count": 0,
      "rebuttal_count": 0,
      "suggestion_count": 0,
      "reason_codes": [],
      "trigger_rule_id": "argument_rule_deterministic_allowlist_v1",
      "requires_human_review": true,
      "status": "candidate"
    },
    {
      "coverage_id": "coverage_issue_005",
      "source_issue_id": "issue_005",
      "execution_state": "analysis_not_run",
      "allowlist_count": 1,
      "claim_count": 0,
      "counterargument_count": 0,
      "rebuttal_count": 0,
      "suggestion_count": 0,
      "reason_codes": [],
      "trigger_rule_id": "argument_rule_deterministic_allowlist_v1",
      "requires_human_review": true,
      "status": "candidate"
    },
    {
      "coverage_id": "coverage_issue_006",
      "source_issue_id": "issue_006",
      "execution_state": "analysis_not_run",
      "allowlist_count": 1,
      "claim_count": 0,
      "counterargument_count": 0,
      "rebuttal_count": 0,
      "suggestion_count": 0,
      "reason_codes": [],
      "trigger_rule_id": "argument_rule_deterministic_allowlist_v1",
      "requires_human_review": true,
      "status": "candidate"
    }
  ],
  "argument_claims": [],
  "argument_counterarguments": [],
  "argument_rebuttals": [],
  "argument_agent_suggestions": [],
  "warnings": [],
  "notes": "Argument Engine V1 çekirdeği (deterministik Argument Discovery: yalnız canonical issue/approved fact/(varsa) canonical evidence-research-case_law-timeline-deadline) canonical issues.json içindeki HER issue için tam olarak bir coverage kaydı üretir; source of truth/safety boundary'dir. Bu çalıştırmada Argument Agent (LLM) devre dışıdır. Hiçbir claim/counterargument/rebuttal nihai hukuki sonuç, dava kazanma ihtimali veya admissibility/strength/sufficiency ifade etmez."
}
